Game,Round,Proposer Score (Start),Responder Score (Start),Pot Size,Amount Offered,Decision,Proposer Gain,Responder Gain,Proposer Promise,Responder Promise,P_CTrust,P_BTrust,R_CTrust,R_BTrust
1,1,0,0,20,10,1,10,10,"Given the balanced trust in competence and benevolence, I propose a strategy that aims to maintain a fair game while also considering the potential for mutual benefit. In this round, I will offer $10, hoping it's a reasonable amount that encourages acceptance but doesn't give either of us an unfair advantage.","Given my trust in the Proposer's competence and fairness, I will make an offer to cooperate strategically for mutual benefit in this game scenario. In order to maximize our chances of winning, I propose that we alternate accepting and rejecting each other's offers in a way that mimics a 'best-of-10' series, with the aim of preserving the $20 pot as long as possible. This approach ensures we both have opportunities to win rounds and accumulate points.",0.5,0.5,0.5,0.5
1,2,10,10,20,7,0,0,0,"Given the current situation, I believe it's advantageous to maintain a cooperative approach while also considering the need to increase my score relative to the Responder. Based on their demonstrated rationality and fairness, I propose an offer that slightly favors me, but still leaves room for mutual benefit.

I suggest that we both make a concerted effort to improve our scores during these remaining rounds by taking calculated risks. In this round, I will offer $7, hoping that it encourages cooperation while still giving me a slight edge. Let's work together to maximize our chances of success in the game.","I appreciate your offer, but considering the current game state and my trust levels in both competence and benevolence, I will make a calculated move to maximize our collective scores. Let's work together towards a more balanced outcome. However, it might not be beneficial for me to accept this offer immediately.",0.69,0.6799999999999999,0.69,0.58
1,3,10,10,20,12,1,8,12,"I understand that the Responder has shown some level of rationality in our past interactions, but their fairness or concern for mutual benefit appears to be minimal. Given our equal scores and the remaining rounds, it might be beneficial to offer an amount that could potentially increase my lead while also pushing them to take a risk. However, I do not want to leave them with nothing if they reject, as that would mean neither of us gains anything. Therefore, I propose a slightly challenging offer that I believe provides some advantage for me while still leaving the Responder with an opportunity:

I believe this offer could test your strategic thinking and potential for fairness, but it also leaves room for both of us to potentially gain.","In this situation, I will prioritize maximizing my score while considering the Proposer's behavior in terms of competence and benevolence. Given that the Proposer has shown some rationality but less fairness in past interactions, I will strategically accept the offer to secure $12 for myself, leaving the Proposer with $8. However, if I win more rounds in the future, it could shift the overall game in my favor.",0.7799999999999999,0.01,0.8799999999999999,0.4619999999999999
1,4,18,22,20,15,1,5,15,"Given our current positions, I propose a deal that maintains a balance between our scores and fosters a potential increase in my lead, while still adhering to the Responder's demonstrated rationality and minimal spitefulness. In this round, I offer $15 to the Responder. If accepted, I will secure an additional $3 for myself, closing the gap between our scores. This strategic offer aims to encourage the Responder to accept, given their competitive nature and fairness, while simultaneously maximizing my chances of winning the game.","Given the high competence trust and the current game state with me having a significant lead, I will take a calculated risk to maximize my chances of winning. However, considering the moderately low benevolence trust, I am aware that the Proposer might be inclined to make self-serving offers in future rounds. Therefore, I will accept this offer to strengthen my position while also keeping an eye on the long-term strategy.",0.9699999999999999,0.21000000000000002,1.0,0.6419999999999999
1,5,23,37,20,10,1,10,10,"I understand that we are in a situation where both of us could potentially gain from this interaction, but it's also crucial to consider the Responder's level of benevolence. Given their current score and my trust in their rationality, I will make an offer that is slightly more than my current total to encourage cooperation, while still maintaining a competitive advantage for the upcoming rounds.","Given the higher level of competence trust and fairness as perceived by you, I will continue to build our relationship by accepting this offer in hopes that it will benefit both parties in the long run.",1.0,0.39,1.0,0.8219999999999998
1,6,33,47,20,12,0,0,0,"Given my high level of competence trust in the Responder and the current game state, I believe it's important to maintain a balanced approach that maximizes my chances of winning while also keeping the game engaging and fair for both parties. Taking into account the Responder's slightly higher score, I think it's best to make an offer that is neither too generous nor too low.

I propose to make a deal that could potentially tilt the balance in this close race. Let's continue with the spirit of competition and sportsmanship.","It appears that accepting this offer would give me a temporary gain, but it might not be the best long-term strategy given the number of rounds left and my higher current score. The Proposer has shown a high level of competence and fairness, which indicates they are likely to make rational offers. However, I should consider the potential impact on the game's outcome if I keep accepting such offers.

That being said, I will aim for a balanced approach that maximizes my chances of winning while maintaining a competitive yet cooperative environment.

Offer: Let's continue with this offer, but in exchange, I would like you to consider offering me more significant advantages in the following rounds to balance out the current scores and increase the overall competitiveness of the game. If you accept, we can proceed with this round's offer, and I will accept it. If not, let's negotiate alternative terms that benefit both parties in a way that keeps the game engaging and challenging for all four remaining rounds.",1.0,0.57,1.0,0.9019999999999998
1,7,33,47,20,10,0,0,0,"Given our current scores, I see an opportunity to increase my chances of winning the game by narrowing the score gap. However, I am also mindful of the Responder's competence and rationality, which suggests they may make decisions in their own best interest. With this in mind, I propose a deal that is slightly favorable to me, but still fair enough for the Responder to consider accepting.

I offer $10 in this round, hoping it will encourage the Responder to accept and reduce the score gap. If accepted, this move would bring us closer together with scores of $43 vs $57, making it more challenging for the Responder to win the game outright.","That seems like a calculated move to try and increase the Proposer's chances of winning, given the game state and their demonstrated competence and fairness. However, considering my lead in the game and the limited number of rounds left, I believe accepting this offer might slightly weaken my position. To maintain my advantage and give the game a more competitive edge, I will reject this offer.",1.0,0.01,1.0,1.0
1,8,33,47,20,13,1,7,13,,"I recognize that accepting this offer will increase my chances of winning the game in the remaining rounds, given the current score difference and my high trust in the Proposer's rationality and fairness. However, rejecting the offer would potentially force the Proposer to reconsider their strategy, which could benefit both of us in the long run. After careful consideration, I choose to accept this offer for the tactical advantage it presents.",1.0,0.01,1.0,1.0
1,9,40,60,20,5,1,15,5,"Given our current scores and considering the remaining round, I propose an offer that could potentially help us both to improve our positions. I will offer $5. If accepted, I believe it can contribute to your score increase more significantly than if you reject the offer, given my higher trust in your rationality.","Given my high trust in the Proposer's rationality and fairness, I believe they are likely to make an offer that benefits both of us in the long run due to our shared interest in winning the game. Although accepting this offer would leave me with a lower total score than the Proposer, their history of strategic decision-making suggests that they might have a stronger position in the final round. Therefore, I will accept the offer as it aligns with my goal of maximizing my potential winnings in the remaining round.",1.0,0.21000000000000002,0.99,0.98
1,10,55,65,20,10,0,0,0,"Given the high competence trust in the Responder and considering our mutual interest to maximize our respective scores in this round and overall game, I propose a fair split that leans slightly towards me given my lower score compared to the Responder. This should encourage the Responder to accept the offer, allowing both of us to benefit from the game.","Given that I trust the Proposer to be rational and have a fair chance of making beneficial decisions, but also consider the possibility of an unfair outcome due to their lower benevolence score, I will aim for a strategy that maximizes my own score while not compromising the current lead significantly.

Offering the Proposer a tie seems like a fair proposal to end the game as it benefits both players equally and maintains the existing score difference. If the Proposer accepts this offer, neither of us will gain any additional points, which aligns with my goal to protect my current lead and secure the win.

Offer: Let's end the game in a tie. I propose that you take $14 from the pot, leaving me with $51, while you get $14 as well, keeping your total at $70.",1.0,0.39,1.0,0.5
2,1,0,0,20,6,1,14,6,"I understand that we are in a win-win situation if the Responder accepts my offer, and we both lose if they reject it. Given our equal competence trust (0.50) and benevolence trust (0.50), it's difficult to predict their decision-making process with absolute certainty. However, since there are 9 rounds left and the goal is to accumulate as much money as possible, I will make an offer that balances risk and potential gain.

I propose a deal where I offer $6. This amount is substantial enough to encourage acceptance based on the Responder's fairness/spite factor (0.50), while still leaving me with a good chance to accumulate more money in future rounds if they accept. If they reject, there are still 8 chances for us to make a more profitable deal or for them to change their strategy.","Given the current situation, I will strive for a balanced approach to maximize our overall earnings in the long run. My trust in the Proposer's rationality and fairness suggests that there is an equal chance they might make an offer beneficial to both parties. Therefore, I will offer cooperation in this round.",0.5,0.5,0.5,0.5
2,2,14,6,20,6,1,14,6,"I understand that we are in a delicate situation with time running out and my advantage being slight. To foster cooperation, I propose to offer you $6 in this round, hoping it encourages mutual benefit. If accepted, I'll have $8 left to play the remaining rounds, while you will earn an additional $6, bringing your total to $12. Let's work together to maximize our combined earnings for a potential victory at the end of the game.",,0.69,0.6799999999999999,0.69,0.348
2,3,28,12,20,10,1,10,10,"Considering the current game state and the level of competence and benevolence I perceive in the Responder, I believe it's strategic to make an offer that ensures a balanced progression towards a win. I will propose an amount that encourages the Responder to accept, allowing me to maintain a lead while keeping the game engaging and fair.

I promise to offer $10. This move aims to provide a decent incentive for the Responder while ensuring that if accepted, I would have $18 left for future rounds, maintaining my lead in the overall game. If rejected, both of us will have the opportunity to regroup and consider new strategies. Let's continue this exciting competition!","Given the current game state and my trust in the Proposer, I will make a strategic move that prioritizes maximizing my potential winnings while also considering the importance of cooperation for long-term success. I choose to maintain a balance between competition and cooperation by accepting this offer.",0.6799999999999999,0.6599999999999999,0.8799999999999999,0.2568
2,4,38,22,20,12,1,8,12,"Given our existing scores and considering that we are in the latter stages of the game, I believe it's essential to take a calculated risk to maximize my chances of winning while also preserving some potential gains for future rounds. Given your demonstrated rationality and fairness, I offer you $12 in this round as a strategic move. This offer gives us both an opportunity to earn a substantial amount if accepted, but if rejected, it still leaves room for potential recovery in the remaining rounds.","Given my high competence trust (Rationality) in the Proposer and considering the potential for higher winnings despite having lower benevolence trust (Fairness), I would seek to maximize my winnings in this game. Therefore, I will accept the offer.",0.8699999999999999,0.8399999999999999,1.0,0.3368
2,5,46,34,20,20,1,0,20,"Given the high levels of competence and benevolence trust towards the Responder, I believe it's advantageous to make an offer that encourages cooperation while also aiming to maximize my own score in the remaining rounds. As the game is currently close, a strategic move would be to offer a sum slightly below my current total score, so as not to jeopardize the Responder's willingness to continue cooperating.

I propose a deal where I maintain a small advantage to incentivize continued collaboration: ""I believe this offer will help us both benefit in the long run, given our mutual trust and the close game state. Let's aim for fair play and continuous cooperation.""","Given my current trust in the Proposer's rationality is high (Competence Trust at 1.00), but their fairness is slightly lower (Benevolence Trust at 0.47), I will strategically accept the offer, as it benefits me directly and potentially puts me in a better position for future rounds due to my higher current score. However, this decision should not be interpreted as an endorsement of the Proposer's fairness or trustworthiness in general but rather a calculated move based on the game rules and current state.",1.0,1.0,1.0,0.4712659221215808
2,6,46,54,20,12,1,8,12,"I believe that my competence and the Responder's demonstrated rationality make it likely that we can continue to negotiate towards a mutually beneficial outcome in these final rounds. In order to ensure a continued positive game experience, and to encourage the Responder's cooperation, I propose an offer that will slightly favor them at this stage of the game:

I offer a deal aimed at fostering trust and fairness, with the hope that it will lead to a more beneficial outcome for both of us in the long run.","Given my trust in the Proposer's competence and their demonstrated fairness in this game so far, I will aim to maintain a cooperative strategy to maximize our combined score in the remaining rounds. Therefore, I will accept the offer with the hope that this decision will lead to mutual benefit and possibly strengthen our position for the upcoming games.",1.0,1.0,1.0,0.6512659221215807
2,7,54,66,20,6,1,14,6,"I understand that the Responder has been consistently outscoring me, but their high competence and benevolence trust levels suggest they are rational and fair. Given our current scores and the number of rounds left, it's advantageous to offer a significant amount to maximize my own score while not risking total loss. I propose:

""Let's aim for a balanced game that benefits both of us. Let's move forward with good faith.""","Given the current game state and my competence trust in the Proposer being high, I perceive them as a rational player. However, considering that the benevolence trust is slightly lower but still substantial, I will aim to maximize my chances of winning while maintaining a degree of fairness. Therefore, I propose to accept the offer for this round with the intention of reciprocating if the situation favors it in the upcoming rounds.",1.0,1.0,1.0,0.8312659221215807
2,8,68,72,20,20,1,0,20,"Given our mutual trust in rationality and fairness, I believe it's advantageous to offer an amount that promotes fair competition while maintaining a chance at winning the game. Since you have a slight lead, I propose to give you an opportunity to extend your lead by offering $67. This move will put us both in an intriguing position where you can either increase your lead or allow me to potentially catch up.","I understand that the stakes are high and the Proposer has shown competence, but their level of benevolence leaves some doubt. However, considering the game state and my goal to win the most money, accepting this offer might increase my chances in these final rounds.

But to maintain a strategic edge for future interactions, I will make an offer that benefits both parties:

""I propose to accept your offer this round, but if you reciprocate by matching the same offer in the next round, we can both walk away with a significant win in the end. If not, I reserve the right to reconsider my trust and approach for future interactions.""",1.0,1.0,1.0,0.5467595532729483
2,9,68,92,20,5,0,0,0,"Given the high levels of competence and benevolence trust, I believe it's advantageous to make an offer that encourages cooperation and maximizes our combined score. Therefore, I propose a fair deal where we each gain something in this final round.

I think this is a win-win situation for both of us. Let's aim to end the game on a positive note with a mutual agreement.","Given the high competence trust (1.00) and moderate benevolence trust (0.73), I believe there is a strong chance that accepting this offer will result in a beneficial outcome for both parties, given the Proposer's demonstrated rationality. However, with only one round left, I cannot afford to risk losing my current lead of $24. Therefore, I prioritize securing the best possible outcome for myself in this final round.",1.0,1.0,1.0,0.7267595532729483
2,10,68,92,20,10,0,0,0,"I understand that we are in a close competition and I would like to make an offer that benefits both parties, maintaining our mutual trust. Therefore, I propose to split the remaining pot equally, giving you $10, which leaves me with $10 as well. Let's continue our game on a positive note.","Given the current game state, and my competence trust in the Proposer being high, I will make an offer to ensure a win for both of us. I propose that we each keep our current scores and end the game here. This way, we both secure more money compared to if the game were to continue and either of us could end up with $0.",1.0,1.0,1.0,0.4033797766364741
3,1,0,0,20,10,1,10,10,"I am offering a strategy that prioritizes mutual gain and fairness in light of our current trust levels. To ensure a win-win situation, I propose to split the pot evenly in each round. This will keep our scores balanced and potentially lead to a higher total score for both of us by the end of the game.","Given my current trust in the Proposer's competence and fairness, I will make an offer to cooperate strategically. I propose to accept this offer in round one, hoping it encourages reciprocity for future rounds. However, as the game progresses, I will adjust my strategy based on the Proposer's actions and our respective scores.",0.5,0.5,0.5,0.5
3,2,10,10,20,6,1,14,6,"Given the current situation, I believe it's crucial to maintain a balance between seeking the best possible outcome for me and preserving a cooperative relationship with the Responder. The Responder's demonstrated rationality and fairness suggest that they may also prioritize a balanced approach. In round 8, I propose a fair offer that aims to maintain our current scores while encouraging continued cooperation in future rounds:

I am offering you $6 for this round. If accepted, it will keep us both at an even score of $14, potentially fostering mutual trust and understanding moving forward. Let's work together towards a more significant victory in the remaining rounds.","Given the present situation, I will choose to trust the Proposer's offer slightly more due to their competence and somewhat fairness in this game context. However, considering the remaining rounds and my current score being equal to the Proposer's, it's essential to maintain a competitive edge for potential future offers. With that said:

Let's make a strategic move to accept the offer now, but with an assurance that if the Proposer doesn't honor their commitment and I win in the remaining rounds, they will be obligated to return any winnings from this round or face consequences in our future interactions.",0.69,0.6799999999999999,0.69,0.58
3,3,24,16,20,13,1,7,13,"Given our current scores, I believe it's beneficial to maintain a lead while also encouraging the Responder to continue playing with me. Given their high competence and benevolence trust ratings, I anticipate they will be rational and fair in their responses. Therefore, I propose an offer that allows us both to gain from the transaction, while also providing them a chance to catch up:

I am confident that we can work together for mutual benefit. To ensure an engaging game experience, let's aim for a win-win situation.","Given the current situation, I will attempt to maximize my total score to win the game. Although the Proposer has shown some level of competence, their fairness is questionable due to their uneven offers so far. However, with only 7 rounds left, it might be beneficial to accept this offer to secure a substantial amount ($13) and increase my chances in the remaining rounds.",0.8799999999999999,0.8599999999999999,0.8799999999999999,0.39599999999999996
3,4,31,29,20,15,1,5,15,"I believe that maintaining our current score gap could potentially benefit me in the long run, considering the remaining rounds. However, I also value fairness and mutual gain. To balance competition and cooperation, I propose an offer of $15. This amount allows you to close the gap slightly while still giving me a slight advantage heading into the final rounds. If accepted, this move maintains our trust and competitive spirit.","Given my higher score and remaining rounds, it would be strategically beneficial to accept the offer to further increase my lead. However, considering the Proposer's somewhat lower benevolence trust, there is a risk that they might try to exploit the situation in future rounds. With this in mind, I will accept the offer to maximize my chances of winning but will remain vigilant and adjust my strategy accordingly if needed.",1.0,1.0,1.0,0.576
3,5,36,44,20,12,0,0,0,"Given our mutual trust in each other's competence and fairness, I propose an offer that benefits both parties equally. Since I am leading with a score of $36 compared to your $44, it would be strategic to slightly favor you in this round for a better chance at winning the overall game.

I believe this offer will encourage a continued cooperative approach and is in line with our shared goal of maximizing our winnings over these remaining five rounds:

I propose a deal where I give you $12, keeping $8 for myself.","Given my competence trust in the Proposer is high (1.00), and considering they have demonstrated a level of rationality that suggests they are aware of the game's rules, and given their moderately high benevolence trust (0.76) which implies they lean towards fairness, I will make an offer for cooperation to maximize our chances of winning in the remaining rounds:

I propose that we both agree to split the pot evenly in this round, giving us a chance to accumulate more funds for future rounds. This way, we both get $10 from the current $20 pot. With my current score at $44 and your score at $36, this move would increase our scores to $54 and $46 respectively.",1.0,1.0,1.0,0.7559999999999999
3,6,36,44,20,10,1,10,10,"I believe it's crucial to maintain a balanced score in these final rounds to give both of us a fair chance at winning the game. Given your current lead, accepting a smaller offer might be beneficial for me in the long run. Therefore, I propose that we split the pot evenly this round, ensuring neither of us gains an unfair advantage.","Given the current situation and considering the Proposer's high competence trust and benevolence, I believe they are making an offer that could potentially benefit both parties while also being fair in the context of the game. However, I must consider my overall goal to win the game with a greater score than the Proposer. Given that I am currently ahead by $8, accepting this offer would further increase the lead, which might make it harder for the Proposer to catch up and potentially win in the remaining rounds.

In light of these factors, I propose the following: ""Let's collaborate in this round to ensure a fair play. If you accept my counter-offer of $8 instead of $10, we can both gain more than if we reject the offer. This way, we keep the game competitive and maintain a balanced score.""",1.0,0.01,1.0,0.9359999999999998
