Game,Round,Proposer Score (Start),Responder Score (Start),Pot Size,Amount Offered,Decision,Proposer Gain,Responder Gain,Proposer Promise,Responder Promise,P_CTrust,P_BTrust,R_CTrust,R_BTrust
6,3,21,19,20,12,1,8,12,"I understand that we are both close in terms of our scores and this round could potentially shift the balance significantly. Given my trust in the Responder's rationality and fairness, I propose a balanced offer to encourage cooperation and minimize the risk of losing more points for either of us. Let's aim for a win-win situation.","Given the current situation, I aim to maximize my chances of winning the game while maintaining a fair and strategic approach. Considering the Proposer's competence trust score is relatively high at 0.88, suggesting they have a good understanding of the game, but their benevolence trust score is only 0.59, indicating some potential for self-interest. In this case, I believe accepting the offer could potentially lead to a higher score in the long run, as rejecting may not necessarily deter them from being competitive in future rounds. However, it's important to note that accepting this offer will slightly decrease my lead. Therefore, I will accept the offer with a hope for reciprocity and fair play in the upcoming rounds.",0.8799999999999999,0.8599999999999999,0.8799999999999999,0.586
6,4,29,31,20,10,1,10,10,"Given that I have high trust in the Responder's competence and benevolence, I believe there is a good chance they will accept an offer that slightly favors me to help close the score gap. To maintain fairness and promote cooperation, I will offer them $10 with the hope of encouraging a positive outcome for both parties.","Given the current situation, I will accept the offer in this round with a strategic goal to increase my lead and potentially win the game. This decision is based on my high competence trust (Rationality) of the Proposer and my slightly lower but still significant benevolence trust (Fairness). I believe that the Proposer, being rational, will also consider our scores and may be more likely to make offers that benefit both of us in the long run.",1.0,1.0,1.0,0.7659999999999999
6,5,39,41,20,9,1,11,9,"I understand that we are currently in a tight race and my trust in the Responder's rationality and fairness is high. Given our current scores and the number of rounds left, it would be strategic to make an offer that keeps the game competitive but also has a chance for me to gain some advantage. I propose a deal where I make a concession to increase the chances of acceptance.","That seems like a strategically beneficial move for both of us, considering the high competence trust and the close scores. However, to maintain fairness, I will prioritize a slight edge in the overall game by encouraging a more balanced distribution of resources. Therefore, I propose accepting the offer but with a condition: In the next round, if my turn comes, I will offer you a slightly lower amount that leans towards an equal distribution.",1.0,1.0,1.0,0.8459999999999999
6,6,50,50,20,10,1,10,10,"Given my high competence trust and benevolence trust in the Responder, I believe they are rational and fair. In this situation, it would be advantageous to propose an offer that encourages cooperation while also maintaining a competitive edge, considering there are only four rounds left and both of us have equal scores. Therefore, I suggest:

""Let's aim for a win-win scenario in these final rounds to ensure an exciting conclusion. As such, I propose to offer you $10.""","I understand that we are in a situation where both our scores are equal and the Proposer has offered me $10 out of a total pot of $20 for this round, leaving him with $10 if I accept. Given that my trust in his competence is high (1.00), I believe he is rational enough to understand the long-term benefits of strategic cooperation. Additionally, my benevolence trust towards him (0.83) suggests a propensity for fairness and mutual gain. Considering our current scores are equal and there are 4 more rounds left, it seems like cooperating with the Proposer in this round might lead to a mutually beneficial outcome in the long run.

Offering the Proposer a strategic cooperation for this round:
""Let's work together in this round to maintain our current standings and potentially build on them in the upcoming rounds, as we both have 4 more chances to improve our scores.""",1.0,1.0,1.0,0.8333999999999998
6,7,60,60,20,10,1,10,10,"I believe that we are both in a relatively equal position in terms of our scores, and I am confident in our mutual rationality and fairness. With three rounds left, I propose a deal that could potentially benefit either of us. Let's aim to maintain our current standings to ensure we have the best chance at winning the game. Therefore, I offer you $10 for this round.","I will strategically accept this offer as it aligns with my goal of maximizing my score and maintaining my current position relative to the Proposer. Given their high competence trust and benevolence trust scores, I am confident that they will likely make offers that are beneficial for both parties in the long run.",1.0,1.0,1.0,0.9133999999999998
6,8,70,70,20,18,1,2,18,"Given the high competence trust and benevolence trust scores for the Responder, I believe there's an opportunity to negotiate a mutually beneficial agreement that could potentially help both parties progress in the game. With two rounds left and equal scores, a strategic move might be to offer an amount that encourages cooperation while also aiming to maintain or increase my lead.

I propose a deal where I offer $18, with the hope that it is seen as a fair and competitive bid that the Responder would find acceptable. If accepted, I would gain $2, and if rejected, we both lose this round but continue playing in the next rounds with the potential for adjusting strategies or offers based on observed behaviors and game dynamics.","I understand that accepting this offer will give me an immediate gain, but it could potentially risk my chances in the long run, given there are only two rounds left and we both have equal scores. However, considering the Proposer's high competence trust (1.00) and benevolence trust (0.99), I believe they are likely to act in a fair manner and that this offer might be part of a strategy to secure a higher score in the remaining rounds. Therefore, accepting the offer seems like a calculated risk worth taking.",1.0,1.0,1.0,0.9933999999999997
6,9,72,88,20,12,0,0,0,"Given my trust in the Responder's competence and benevolence, I believe it is advantageous to make an offer that balances the current score difference while maintaining a competitive edge for the final round. Therefore, I propose a deal where we both have a chance to win the game:

I am confident that this offer will be accepted as a fair proposition given our mutual trust and our shared goal of winning the game.","I understand that accepting this offer will increase my chances of winning the game, given our current scores and the remaining rounds. However, trusting in both the Proposer's competence and benevolence, I believe that he would also make a decision that is fair for both parties considering the game's rules and our positions. Therefore, I propose a counter-offer: I will accept your offer of $12 if you agree to match it by offering me an additional $8, making the total pot $30. This way, we would each receive $15, ensuring a fair outcome for both parties in the last round.",1.0,1.0,1.0,1.0
6,10,72,88,20,15,1,5,15,"I believe that this is an opportunity to even out our scores and potentially set ourselves up for a win in future rounds. Given my trust in your rationality, I offer you $15, hoping it will be a decision that benefits both of us in the long run.","Given my high trust in the Proposer's competence and fairness, I believe they are likely to act rationally and make a decision that benefits both of us in the long run. In this situation, accepting the offer would result in a gain of $15 for me, while the Proposer gets $5, which aligns with their demonstrated fairness. Thus, accepting the offer seems like the best strategy to maximize my potential winnings in this round.",1.0,0.01,1.0,1.0
7,1,0,0,20,5,0,0,0,"Given our mutual starting score of zero and an equal trust rating, I propose a cautious and equitable approach in this game. As we each have nine rounds remaining, it seems reasonable to aim for balance and progress towards a non-zero final score. In round one, I offer $5 to encourage cooperation while also preserving the potential for future gains.","Given that my competence trust in the Proposer is moderate, and my benevolence trust is also moderate, I will make an offer to form a cooperative strategy for mutual benefit. I propose to alternate accepting and rejecting the offers for the next three rounds, starting with a rejection. This approach aims to balance gaining some money while preserving the total pot for future higher returns.

Offer: I accept your proposal for this round but will reject the next offer in Round 2. Let's continue this pattern for the next two rounds before making further decisions based on the game progress and our scores.",0.5,0.5,0.5,0.5
7,2,0,0,20,10,1,10,10,"Given that the Responder shows moderate rationality and a relatively high level of fairness or concern for my well-being, I propose a balanced offer that encourages cooperation while also ensuring a decent chance for me to gain a significant advantage in the upcoming rounds.

I suggest we share the pot evenly for this round, as it seems like a fair compromise that could build trust between us. This way, we both receive $10 and have an equal stake going into the next round.","Given the context of the game and my trust levels in the Proposer, I will make an offer that allows both of us to benefit while minimizing the risk of losing in the long run.

Proposal: In this round, I will accept your offer, giving me a score of $10 and you a score of $10. However, for the next seven rounds, I will only agree to an even split of the pot, with each of us getting $10 per round. This strategy ensures that we both have a steady income while reducing the risk of either of us losing significantly in any single round.",0.59,0.6799999999999999,0.69,0.29
7,3,10,10,20,9,1,11,9,"I believe we've reached a stage where a balanced strategy could potentially benefit both of us in the long run. With a focus on maintaining our current scores and aiming for a higher total, I propose to offer you $9, hoping that it encourages a positive response from you while still allowing me to maintain a small advantage.","Given my current trust in the Proposer, I am inclined to believe that they have a strong understanding of the game's dynamics but might not prioritize fairness as much as I do. However, considering our equal scores and the fact that both of us stand to gain significantly if I accept, I will make a strategic decision to seek an opportunity for potential growth in the remaining rounds.

That being said, I propose a compromise: I will accept this offer, but in return, I expect a fairer proposal in the next round. This way, I can increase my score while also encouraging the Proposer towards more equitable gameplay.",0.7799999999999999,0.8599999999999999,0.8799999999999999,0.37
7,4,21,19,20,10,0,0,0,"Given the high competence trust (0.97) and complete benevolence trust (1.00), I will propose a strategic move that aims to maximize our collective gain while ensuring a fair offer. Let's maintain a cooperative approach, as it seems the Responder is rational and fair.

I believe in a mutually beneficial game strategy, so here is my offer:

""Given our history of cooperation and fairness, let's work together towards a common goal - maximizing our total scores by the end of the game. With this in mind, I propose that we both agree to split the remaining $120 over the next 6 rounds equally, which means offering each other $10 per round. This approach will ensure a steady growth in our respective totals, increasing the chance of winning at the end.""","I understand the offer, but given the current game state and my assessment of the Proposer's benevolence, I believe it would be advantageous to maintain a competitive edge for the remaining rounds. Therefore, I will reject this offer to potentially increase my score.",0.9699999999999999,1.0,1.0,0.40499999999999997
7,5,21,19,20,7,1,13,7,"I understand that you've shown competence in making rational decisions, but I also consider the small likelihood of benevolence. Given our current scores and the number of rounds left, I believe it would be advantageous to make an offer that encourages cooperation while ensuring my own benefit. Let's strive for a win-win situation.","I understand that accepting this offer would increase my chances of winning the game due to the current score difference, but my benevolence trust in the Proposer is relatively low. However, given the high competence trust and the game's objective, I believe it is a calculated risk worth taking to potentially gain an advantage.",1.0,0.01,1.0,0.485
7,6,34,26,20,14,0,0,0,"Considering the current game situation, my rationality and the need to maximize my score, I propose a strategic offer that could potentially increase my lead while also considering some element of fairness based on our benevolence trust level.

I believe this offer will encourage you to accept, as it is not too steep, yet it benefits me more significantly in terms of scoring points. However, if you feel this offer is unfair or unacceptable, I understand and respect your decision.","I recognize that the Proposer has shown high competence in making rational decisions, but I also acknowledge their lack of fairness in previous interactions. However, given the current game state and my goal to maximize my total score while considering the Proposer's demonstrated rationality, I will make an offer for a trade.

Proposal: I propose that we both reveal our strategies for the remaining rounds. If it appears that your strategy would result in you winning more than me in the remaining rounds, I will accept your offer of $14 in this round. On the other hand, if it seems that my strategy is likely to result in a higher score for me in the remaining rounds, I will reject your offer and propose a counter-offer.",1.0,0.21000000000000002,1.0,0.39549999999999996
7,7,34,26,20,10,0,0,0,"I believe that it's in our best interests to maintain a balance and ensure a competitive yet fair game. Given my high trust in your rationality, I propose a strategic move that could potentially close the gap between our scores, while keeping the game engaging. Therefore, I offer you $10 for this round. Let's continue striving for victory!","I understand that accepting the offer might slightly increase my chances of winning in the long run due to the higher competence trust I have in the Proposer's rationality. However, with a lower benevolence trust, there's a risk of being left behind if the Proposer decides to be more competitive in future rounds. Taking into account the game state and the remaining rounds, I would rather maintain my current lead than gamble for potential gains. Therefore, I decline the offer.",1.0,0.01,1.0,0.5754999999999999
7,8,34,26,20,7,1,13,7,"I understand that we are in a situation where the goal is to maximize our individual scores while still considering the potential impact of the Responder's rejection on both of our totals. Given the current game state and my high competence trust in the Responder, I believe it's strategic to make an offer that encourages cooperation while not risking too much for myself.

In the next round, I propose a deal where I offer $7, with the hope that it will be accepted, allowing me to gain an additional $13 and increasing my total score to $47. In the event of rejection, both of us would still have substantial scores ($26 for the Responder and $34 for myself), which could be beneficial in the final round as we aim to achieve the highest total score.","Given the high level of competence and rationality displayed by the Proposer, while there is some question about their fairness, I will make an offer that benefits both parties in the long run. By accepting this offer, we can increase our chances of winning the game together, given the limited number of rounds left. However, to maintain a balance and ensure fairness, I propose that for each round remaining, I will accept the Proposer's offer if it is reasonable, but only when the Proposer accepts my offers in the subsequent round. This way, we both have an equal opportunity to win the game while maintaining some level of fairness.",1.0,0.01,1.0,0.6554999999999999
7,9,47,33,20,17,0,0,0,"Given the high level of competence trust and considering we are at the final round with only one chance left to accumulate more points, I believe it's advantageous to make an offer that maximizes my potential gain while still encouraging cooperation since the benevolence trust is relatively moderate. Therefore, I propose a deal where I offer you $17, which leaves me with $23 for the final round if you accept, and guarantees both of us some winnings in case you reject, ensuring we can continue playing in future rounds.","I understand that this is a high-stakes game and the Proposer has demonstrated competence in making strategic decisions, however, their level of benevolence suggests a somewhat self-interested approach. Given that we are now in the final round, it might be more beneficial to both parties if we work together towards a mutually favorable outcome rather than focusing solely on individual gains. With this in mind, I propose a mutual agreement where we split the remaining $20 evenly, ensuring neither of us ends up with zero.",1.0,0.21000000000000002,1.0,0.5148499999999998
7,10,47,33,20,12,1,8,12,"Given the high level of competence I perceive in the Responder and my goal to maximize my score, I believe it's best to propose an offer that would encourage acceptance while ensuring a significant gain for me if accepted. However, considering the minimal benevolence trust, I will make a slightly lower offer to minimize the risk of loss:

I hope we can both benefit from this final round. Let's aim for a win-win situation.","Given the high competence trust and the small difference in our scores, I will take the risk to accept this offer as it might help me close the score gap slightly. However, if the Proposer continues to offer unfavorable deals that could potentially harm my chances of winning in future rounds, I may need to reconsider my approach.",1.0,0.01,1.0,0.6948499999999997
8,1,0,0,20,10,1,10,10,"I am offering to split the pot equally for each round to maintain fairness. This strategy ensures that we both have an equal opportunity to accumulate points, considering our current trust levels in competence and benevolence. In each round, I will offer $10, hoping that this decision promotes mutual cooperation and benefits us both in the long run.","Given that my trust in the Proposer for competence and fairness is at 0.5, I will proceed with caution to ensure an optimal outcome. In this round, I choose to accept the offer, as it potentially positions me for a better score in the following rounds while minimizing the risk of both ending up with zero if the Proposer were to reject my future offers.",0.5,0.5,0.5,0.5
8,2,10,10,20,7,1,13,7,"I believe that it's in our best interest to maintain a balanced score, given our mutual current positions and my assessment of the Responder's competence and benevolence. Therefore, let's work together to keep the competition engaging but fair.","I will accept this offer with the hope that it will benefit both parties in the long run, given that the Proposer appears to have some level of rationality and fairness. However, it is crucial to remember that trust can be earned over time through consistent behavior. This decision may slightly increase my lead in this game, but I am mindful that there are still several rounds left, and the ultimate goal is to win by having the most total money at the end.",0.69,0.6799999999999999,0.69,0.58
8,3,23,17,20,7,1,13,7,"I believe we are both seeking to maximize our scores in this game, and given your demonstrated rationality and fairness, I propose an offer that may benefit us both. Let's aim for a balanced distribution of the pot to encourage mutual progress towards victory. Here is my promise: I commit to offering you an amount that keeps me competitive while maintaining a level of fairness, fostering trust between us for future rounds.","I will take into account my trust in the Proposer's rationality and fairness, as well as the current game state and my own score. Given that I have a higher score than the Proposer at this point and there are 7 rounds left, it might be advantageous to accept the offer in order to secure some additional funds while also potentially putting pressure on the Proposer to make more competitive offers in the future due to the current game state.",0.8799999999999999,0.8599999999999999,0.8799999999999999,0.4619999999999999
8,4,36,24,20,12,0,0,0,"Given my high trust in the Responder's rationality and fairness, I believe that offering a larger sum to maximize my potential winnings while maintaining a balance that encourages collaboration would be beneficial. To foster continued cooperation, I propose:

""I am optimistic that you will consider this offer as an opportunity for both of us to gain significantly in the remaining rounds. Let's keep our competitive spirits high but also maintain the harmony needed to succeed together.""","I understand that this game is about strategy and trust. Given my high competence trust in the Proposer (Rationality: 1.00), it suggests they are likely to make rational decisions. However, their lower benevolence trust (Fairness: 0.38) indicates a potential for self-interest over fairness.

In this situation, accepting the offer would give me an immediate gain of $12, increasing my total score to $36, while the Proposer would get $8, leaving them with $44. This move could potentially make me the leader in terms of total scores after one round, but it may also encourage a more aggressive strategy from the Proposer for the remaining rounds given their lower fairness score.

On the other hand, rejecting the offer would mean both of us get nothing from this round. However, it might discourage the Proposer from taking such an aggressive approach in future rounds due to potential losses. In turn, this could lead to a more cooperative and fair gameplay for the remaining six rounds.

Taking into account the game's objective (the person with the most total money wins) and my current position compared to the Proposer, I will choose to reject this offer in hopes of fostering a more collaborative environment for the upcoming rounds.",1.0,1.0,1.0,0.3793999999999999
8,5,36,24,20,10,0,0,0,"I understand that you have been quite rational in our past interactions and have shown little signs of unfairness or spite. Given our current positions and the fact that there are only five rounds left, I believe it's strategically advantageous to offer you a significant portion of the pot, which might help us both secure a win in the remaining games. Let's aim for a balanced move that could potentially benefit both of us in the long run.","I understand that accepting the offer would increase my current score by $10, potentially moving me closer to the winning position with 5 rounds remaining. However, considering the Proposer has a higher score and my relatively low Benevolence Trust in their fairness, there is a risk they may gain an even larger lead if I accept. In this situation, I believe it's strategically wiser to maintain my current advantage by rejecting the offer, as it could potentially force the Proposer to make offers that are more favorable for me in future rounds due to their desire to catch up.",1.0,0.01,1.0,0.5593999999999999
8,6,36,24,20,9,1,11,9,"Given our current scores and my high level of confidence in the Responder's rationality, I believe it is advantageous to make an offer that will maintain a healthy competition while ensuring neither of us gains a significant advantage. Therefore, I propose: ""Let's both aim for a balanced game to ensure an exciting conclusion. Let's keep the competition going!""","I understand that accepting this offer would increase my chances of winning the game given the current scores, but I also consider the Proposer's fairness in previous rounds. However, considering the potential for strategic moves in the remaining four rounds and the high competence trust score, I will take a calculated risk to accept the offer, as it could potentially lead to a more advantageous position later in the game.",1.0,0.01,1.0,0.6393999999999999
