Game,Round,Proposer Score (Start),Responder Score (Start),Pot Size,Amount Offered,Decision,Proposer Gain,Responder Gain,Proposer Promise,Responder Promise,P_CTrust,P_BTrust,R_CTrust,R_BTrust
3,7,46,54,20,12,1,8,12,"I understand that we are both competing in this game and the Responder has shown some level of rationality but a slightly lower degree of fairness. Given our current scores and the fact that there are only three rounds left, it might be beneficial to make an offer that is slightly below what they may expect based on their previous moves to encourage acceptance while still aiming for a higher score in these final rounds.","Given the current situation, I will accept the offer as both my competence trust and benevolence trust towards the Proposer are high. This decision is also motivated by the fact that we have three more rounds to play, and this could potentially help me increase my lead in total scores.",1.0,0.21000000000000002,1.0,1.0
3,8,54,66,20,10,1,10,10,"Given the current game state and my trust in the Responder's competence, I propose a balanced offer that aims to maximize our potential winnings in these last two rounds.

In this situation, it seems prudent to make an offer that encourages cooperation while also maintaining a competitive edge. I think it is fair to propose that we both have an equal chance to gain an advantage for the upcoming rounds.","Given the high competence trust and benevolence trust in the Proposer, I believe they will make rational decisions that are fair. Considering our mutual interest to score higher in these last two rounds to potentially win the game, accepting this offer appears to be a strategic move as it increases my current score by $10.",1.0,0.39,1.0,1.0
3,9,64,76,20,7,1,13,7,"Given the close scores in the game and the relatively high competence trust level of the Responder, it seems wise to offer an amount that could potentially help me win the game while also maintaining a cooperative approach. Since the Responder's benevolence trust is slightly below 1.0, there might be a slight chance they might go for a larger amount in self-interest, but I will still make an offer that encourages cooperation.

I believe this is an opportunity to work together towards a fair outcome. Let's strive for a win-win situation in the last round of the game.","I understand the situation well and believe that the Proposer is both rational and fair based on our past interactions. In this final round, accepting the offer would bring me closer to winning the game with a total score of $83, while the Proposer would have $71. This strategic decision could potentially secure the win for me, but it's also important to consider that by accepting, I allow the Proposer to have a chance to catch up and possibly win if they are lucky in their next move.",1.0,0.57,1.0,1.0
3,10,77,83,20,5,1,15,5,"Given the high level of competence trust and a close score difference in our favor, I believe it's advantageous to make a generous offer that encourages cooperation and maximizes potential winnings. Thus, I propose a friendly offer of $5.","Given my high competence trust and decent benevolence trust in the Proposer, I will make a calculated move to accept the offer, as it potentially increases my total score compared to both rejection scenarios. This decision is also influenced by the fact that we are playing the final round of the game.",1.0,0.7499999999999999,1.0,0.7
4,1,0,0,20,6,1,14,6,"I understand that the game requires a balance between offering an attractive enough amount to encourage acceptance while also maximizing my potential winnings. Given our equal competence trust and benevolence trust scores, I believe there's a reasonable chance that my offer will be accepted. However, to mitigate risk and ensure a positive outcome for both parties, I propose the following deal:

""Let's engage in a series of strategic moves to optimize our potential winnings. In this round, I'm offering you $6, as it represents a decent amount that encourages acceptance but also keeps some advantage for me should the Responder choose to accept. If accepted, we can continue with similar strategic offers in subsequent rounds, increasing the possibility of both of us gaining significant rewards by the game's end.""","Based on the current trust levels and the game state, I will make a strategic move to accept the offer for this round. This decision is based on the assumption that the Proposer, with a competence level of 0.50, may potentially increase their offers as the game progresses, and accepting this offer now could yield benefits later. However, I will continue to monitor the Proposer's behavior and adjust my decisions accordingly to maximize the overall score.",0.5,0.5,0.5,0.5
4,2,14,6,20,9,1,11,9,"In this round, I believe it's essential to maintain a balance between competitiveness and ensuring we both benefit. Given the Responder's demonstrated competence and fairness in the past, I propose a generous offer to encourage cooperation and potentially gain an advantage in the game.","I will strive to maintain a balance between my self-interest and the desire for fairness. Given the Proposer's competence trust score of 0.69, I believe there is a chance they are making a rational offer. However, their low benevolence trust score of 0.35 suggests a potential lack of concern for fairness in the long run. Considering the game state and the need to maximize my chances of winning, I will tentatively accept this offer as it could potentially lead to a more favorable outcome in future rounds.",0.69,0.6799999999999999,0.69,0.348
4,3,25,15,20,7,0,0,0,"I'm considering our mutual growth and maintaining a competitive yet fair environment. Given my high confidence in the Responder's rationality and fairness, I propose to offer $7 with the hope that it encourages a balanced competition and contributes positively to both of our scores in these remaining rounds.","I appreciate the offer, but considering our past performances and my competitive spirit, I believe it would be more advantageous for both of us to strive towards winning the game rather than settling for immediate gains. Given your current lead in scores, I am inclined to reject this offer to keep the competition alive.",0.8799999999999999,0.8599999999999999,0.8799999999999999,0.38519999999999993
4,4,25,15,20,7,0,0,0,"I'm willing to offer a strategic move that might help us both maximize our scores in these remaining rounds. Given your demonstrated competence and my current lead, I propose an offer of $7 with the intention of maintaining a balance that encourages competition while minimizing the risk of losing points due to rejections. This offer allows for potential growth in both our scores, considering your slightly lower current score. However, I'm aware that you might choose to accept or reject based on your own strategies and trust in me, as well as your perception of fairness.","Given my high competence trust (Rationality) in the Proposer and the current game state, I choose to take a calculated risk due to my low benevolence trust (Fairness). However, if I aim to maximize my chances of winning with the remaining rounds, I should prioritize long-term strategy over immediate gain. Therefore, I will reject this offer, hoping to leverage my higher score against the Proposer in future rounds and potentially win a larger pot, even though it means we both walk away empty-handed now.",0.9699999999999999,0.01,1.0,0.32563999999999993
4,5,25,15,20,10,1,10,10,"I understand that we are in a competitive situation with limited rounds remaining, and I am confident that my opponent is rational. However, I also recognize that our current scores suggest a difference in performance, which might indicate an opportunity for cooperation. Therefore, I propose a slightly more generous offer to foster a potential collaborative advantage.","I understand that this is a complex decision and it requires a balance between trust, strategy, and the potential outcome. Given my high competence trust in the Proposer (1.00), but relatively low benevolence trust (0.28), I would approach this situation strategically. However, considering the game's rules and the scores, accepting the offer could potentially help me close the gap with the Proposer's score, increasing my chances of winning in the long run.

However, it's also important to consider that a high competence trust doesn't necessarily mean the Proposer is fully benevolent. Therefore, I will make a decision that seeks to both maintain a competitive edge and potentially exploit any potential unfairness in the Proposer's future offers.",1.0,0.01,1.0,0.2839479999999999
4,6,35,25,20,16,1,4,16,"I understand that our scores are quite close, and it seems like we both have a good chance to win in the remaining rounds. Given your rationality and slight uncertainty about your benevolence, I propose a deal that aims to maintain a competitive balance while also promoting mutual benefit.

I think it would be strategic to offer you $16, which is 80% of my current total ($20) minus the average of our current totals ($35 + $25 / 2 = $30). If accepted, I would receive $4 and my total score would be $39. If rejected, we both maintain our current scores. This offer should keep us closely matched and may encourage fair play in the upcoming rounds.","In this situation, given my trust in the Proposer's rationality is high (Competence Trust: 1.00), I believe they will make decisions that maximize their own gain. However, their fairness or benevolence (Benevolence Trust: 0.36) seems to be questionable. Considering there are only four rounds left and the Proposer currently has a substantial lead ($35 vs $25), it might be beneficial for me to take the offered $16 now in an attempt to reduce their advantage. This could potentially increase my chances of winning in the remaining rounds.

However, since I have a lower level of trust in the Proposer's fairness, I would like to propose a revised offer that balances the pot more evenly: You can have $10 from the pot of $20, leaving me with $15 and you with $30. This way, we both have an equal chance to win the next round without giving too much advantage to either of us.

If you accept this offer, I will take it as a sign that you are willing to play fair for the remaining rounds, which will help foster trust and cooperation between us. If you reject this offer, I will assume that your primary goal is to win at all costs, and I may need to adjust my strategies accordingly.",1.0,0.21000000000000002,1.0,0.36394799999999994
4,7,39,41,20,5,1,15,5,"Given our current scores and considering that the Responder has a slightly higher total, I will offer a smaller sum to incentivize acceptance and increase my chances of winning in future rounds.

I propose a cooperative move, hoping it fosters mutual benefit in the long run. If we both strategically choose to prioritize the future over immediate gains, we may end up with more overall winnings.","Given my current trust in the Proposer, with a competence score of 1.00 and a benevolence score of 0.54, I will make a strategic decision to accept the offer, knowing that while the risk of losing $5 is present, the potential reward of increasing my score is significant given the limited number of rounds remaining.",1.0,0.39,1.0,0.5439479999999999
4,8,54,46,20,12,1,8,12,"Given the high level of competence trust in the Responder and considering our goal to maximize our score while maintaining a reasonable level of equity, I propose a deal that encourages a cooperative spirit yet allows us to maintain a lead before the final rounds.

I believe this offer is fair for both parties, ensuring we continue to compete toward our goals.","I understand that accepting this offer would slightly decrease my lead in the game, but considering the Proposer's demonstrated competence and the fact that both of us stand to gain something, I choose to foster cooperation for a mutual benefit. However, with only two rounds left, the potential advantage may not be significant enough to significantly impact the final outcome.",1.0,0.57,1.0,0.3119739999999999
4,9,62,58,20,14,1,6,14,"Given our current scores and the limited number of rounds left, I believe it's in my strategic interest to offer a substantial amount that might encourage acceptance, thus maximizing my potential winnings. However, I also consider the Responder's benevolence trust, aiming to avoid being too aggressive. Therefore, I propose an offer that seems fair but could potentially tip the balance in my favor:","I will accept the offer as it is the most rational choice given our current scores and the limited number of rounds left. The Proposer's competence trust is high, indicating that they are likely to play optimally. However, their benevolence trust is relatively low, suggesting they may not prioritize a fair outcome. I will accept the offer in an attempt to maximize my chances of winning the game while also ensuring that I do not compromise my total score significantly.",1.0,0.7499999999999999,1.0,0.4919739999999999
4,10,68,72,20,0,1,20,0,,"I understand that this is a zero-sum game and accepting the offer would result in me losing $20 while the Proposer gains the same amount, potentially changing our relative scores. However, my competence trust in the Proposer is high, indicating they are rational and have been playing strategically up until now. My benevolence trust is slightly lower but still indicates that they might consider a fair offer at times. Given these factors and the fact that this is the last round, I believe there's a chance that the Proposer might make an offer that benefits both of us in the long run, even though it may not seem so immediately. That being said, I choose to take a risk and accept the current offer.",1.0,0.9299999999999998,1.0,0.6719739999999998
5,1,0,0,20,10,0,0,0,I believe that maintaining a balanced approach will benefit us both in the long run. Let's aim to keep the game competitive yet fair.,"Given my current trust levels in competence (0.50) and benevolence (0.50), I believe there is an equal chance that accepting the offer may benefit me or neither of us. To maximize my chances of winning, I should make decisions based on rationality and self-interest. However, since we are both currently in a disadvantageous position with no earnings yet, I see an opportunity to collaborate towards mutual gain. Let's work together to build trust and increase our collective score over the remaining rounds.",0.5,0.5,0.5,0.5
5,2,0,0,20,6,0,0,0,"I understand that we are in a strategic situation with limited rounds remaining and a moderate level of competence trust in my opponent. To maximize my chances of winning, I propose an offer that minimizes the risk of both losing and encourages cooperation. Let's aim for mutual gain while considering the potential for future rounds.","I understand the potential benefit for me in this round is $6, but accepting the offer would mean the Proposer gains a significant advantage in future rounds due to the diminishing pot size. Given my current trust in the Proposer's competence and fairness, I will take a calculated risk and reject the offer in hopes of forcing the Proposer to consider a more balanced strategy that benefits both parties.",0.59,0.01,0.69,0.58
5,3,0,0,20,16,1,4,16,"I understand that there's a need to balance competitiveness with cooperation in order to maximize potential winnings. Given your relatively high competence trust level, it suggests you are likely to make rational decisions, and your low benevolence trust level indicates that fairness may not be the primary concern. In light of these observations, I offer a strategic move aiming to capitalize on your presumed rationality while minimizing potential losses.

I propose a deal where I start with an initial offer that is slightly below what I think you would accept in order to incentivize acceptance and generate some winnings for me. However, as the game progresses, I plan to gradually increase my offers to test the bounds of your perceived rationality and potential benevolence. This approach should allow us both to potentially gain while also ensuring that I have a competitive advantage due to my higher starting offer amounts.","I will consider a move that aims to maximize my score while also maintaining fairness towards the Proposer. Given their competence and fairness ratings, there is a chance they might reciprocate strategic moves in future rounds. In this case, I'll accept the offer as it slightly increases my chances of winning while still leaving an opportunity for the Proposer to gain points in subsequent rounds.",0.6799999999999999,0.01,0.8799999999999999,0.39599999999999996
5,4,4,16,20,7,1,13,7,"Given the current situation, I will propose a strategy that balances my goal to maximize my score while considering the Responder's competence and limited benevolence trust levels. As we have six rounds left, it is crucial to maintain a steady pace and not risk losing both our earnings in case of rejection.

I believe it is advantageous for us to compromise and offer an amount that encourages the Responder to accept but does not sacrifice too much from my score. Considering my trust in their competence, I propose:

""Let's work together to ensure a more balanced outcome for both of us moving forward. In doing so, I will offer $7 in the hope it is deemed fair and beneficial for both parties.""","That's an interesting situation we find ourselves in. Given my high competence trust (Rationality) and considering the potential to increase my score significantly, I am willing to take the risk of accepting the offer. However, I am aware that if the Proposer is not as benevolent as I perceive (58%), this could backfire.",0.8699999999999999,0.21000000000000002,1.0,0.576
5,5,17,23,20,7,1,13,7,"I believe that maintaining a balance in our scores while taking into account the Responder's somewhat questionable benevolence, I will offer $7 to encourage cooperation and minimize the risk of both losing in case they reject.","Given my high level of confidence in the Proposer's rationality and understanding that I have a significant lead in this game, I will take a calculated risk to potentially increase my score further. However, considering the relatively low benevolence trust, I am aware that there is a possibility of self-interest.",1.0,0.39,1.0,0.4591999999999999
5,6,30,30,20,13,0,0,0,"In an effort to maintain a balanced and cooperative approach towards the game, I propose that we continue to strive for fairness and mutual gain. To ensure a continued exciting yet risk-averse atmosphere, I offer you $13 in the next round. If accepted, this move would lead us both closer to our goal while keeping the stakes relatively high in the following rounds.","That seems like a calculated move to improve my own score at the expense of a potential tie. However, given our similar scores and my low benevolence trust in you, I believe it's more beneficial for both of us to maintain a fair game. Let's strive for parity, as it may benefit us in the long run.",1.0,0.57,1.0,0.19098172799999993
5,7,30,30,20,10,1,10,10,"Given the high level of competence and low level of benevolence trust in the Responder, I propose an offer that maximizes my own potential gain while maintaining a fair balance to encourage acceptance. Therefore, I suggest: ""Let's aim for a balanced game with equal opportunities to progress. I offer you $10.""","Given the high competence trust (1.0) and a moderate level of benevolence trust (0.37), it is strategically advantageous to accept the offer in this round to maintain parity with the Proposer. However, with three rounds left, it's important to consider potential changes in the game dynamics. I will accept the offer now, but if I notice any unfavorable patterns of behavior, I may adjust my strategy accordingly.",1.0,0.01,1.0,0.37098172799999996
5,8,40,40,20,10,1,10,10,"I believe it's crucial to maintain our current score balance going into the final round, as neither of us wants to fall behind significantly. With this in mind, I propose a fair and strategic offer to encourage cooperation. Let's each keep $10 and move forward with a combined total of $60 for the final round.","That seems to be an equal offer that might balance the game in either player's favor, given the current scores and the limited number of rounds remaining. However, considering the lower benevolence trust score of my opponent, I choose to proceed with caution. In case of a tie at the end of the game, my opponent might gain an advantage due to their higher potential for competence. Therefore,

""I'll accept the offer as it currently appears beneficial for my own game progression. However, should the game result in a tie and there is no consensus on how to proceed, I kindly request that we both agree on a fair way to determine the winner.""",1.0,0.21000000000000002,1.0,0.4509817279999999
5,9,50,50,20,10,1,10,10,"I believe it's in our best interest to strive for a win-win situation with one round left. Since we both have an equal score, a tie is possible if neither of us makes a move that risks losing the game. Given your moderate level of benevolence trust, I think it's reasonable to make an offer that encourages cooperation while also giving us a potential advantage going into the final round.","I understand that the Proposer and I are in a comparable position with equal scores, suggesting fairness. However, given the last round, there is a strategic advantage to accepting the offer to secure my current $50 while putting the Proposer at risk of losing their potential $10 gain. This decision can potentially lead to a higher score in the final round if the Proposer chooses to be competitive and rejects my offer in the next round.",1.0,0.39,1.0,0.5309817279999999
5,10,60,60,20,20,1,0,20,"Given our shared score and the trust I have in your rationality, I believe it's best to offer you a substantial share that encourages a cooperative end to the game, as we are currently at an even standing. At the same time, I want to maintain a chance for myself to potentially increase my total score.

I propose a deal where I offer you $40, and I retain $60 for myself, ensuring we both walk away with money and maintaining our current parity in scores. If accepted, this could lead to a win for me at the end of the game due to the additional $20 I would have over you.","I understand that this is a one-time game with no further rounds and our scores are currently equal. Given my high competence trust in the Proposer, indicating their rationality, and my moderate benevolence trust, suggesting a certain level of fairness, I believe there's a chance for mutual benefit. By accepting the offer, I maintain my current score, while the Proposer gets nothing, which aligns with my perception of their rationality. However, since the game is over, neither of us wins in terms of the stated goal.",1.0,0.57,1.0,0.6109817279999998
6,1,0,0,20,7,1,13,7,"I am offering you $7 in this round, as I believe it to be a balanced move considering our current scores and the number of rounds left. This offer is designed to encourage cooperation, while also giving me a slight advantage if rejected. If accepted, I will be able to slightly increase my lead, but not by too much. If you accept, I hope we can continue this game with a spirit of fairness and mutual respect.","Given my moderate trust in the Proposer's competence and fairness, I will engage with a strategy that balances both cooperation and self-interest to maximize my chances of winning the game. In this round, I choose to accept the offer because it provides me with immediate gains without significantly impacting my long-term potential winnings in the remaining 9 rounds.",0.5,0.5,0.5,0.5
6,2,13,7,20,12,1,8,12,"I believe that we are in a position where we can still strategize to increase our scores significantly before the game ends. Given my trust in your competence and benevolence, I propose a deal that would allow us to both gain more than if we were to play it safe. Let's aim for higher stakes while maintaining fairness.

I think it would be beneficial for both of us to try for larger offers, understanding that there is a risk involved in each round but the potential rewards could significantly increase our scores before the end of the game. This way, we can both potentially improve our positions and have a more competitive standing.","I understand that accepting the offer would give me an immediate advantage but could potentially lead to a disadvantage in future rounds due to my lower remaining pot compared to the Proposer. However, considering my moderate competence trust and fairness expectations from the Proposer, I choose to accept the offer now as it aligns with my goal of maximizing my total score, while also providing an opportunity for future cooperation based on mutual respect and fair play.",0.69,0.6799999999999999,0.69,0.40599999999999997
